{
  "v": "0.1",
  "lang": "gsw",
  "intent": "scheduling.remind",
  "slots": {
    "subject": "the dentist appointment"
  },
  "missing_slots": [
    "time"
  ],
  "clarification_needed": true,
  "clarification_question_local": "Wänn söll ich di erinnere?",
  "canonical_intent_en": "Remind me about the dentist appointment <time>",
  "suggested_route": "clarify",
  "required_data_classes": [
    "calendar.events"
  ]
}
